{
  "id": "a308d5ec-ac54-460a-aec2-50f5e438d7de",
  "name": "Rebate refund",
  "refundAllocationInstance": "RefundCreditMemoAllocation",
  "effectiveDate": "2021-08-07",
  "appliedDate": "2021-07-10",
  "allocatedAmount": 40.0,
  "refundBalanceAmount": 0.0,
  "hasBeenUnapplied": false,
  "unappliedDate": null,
  "relatedRefundAllocation": "",
  "externalCreatedDate": "2021-06-23",
  "creditMemoId": "b78a2579-5d21-4b38-90ff-e1d6ea680502",
  "creditMemoBalanceAmount": 0.0,
  "auditInfo": {
    "createdDate": "2023-04-30T17:25:11.128Z",
    "createdBy": "Application Admin",
    "updatedDate": "2023-04-30T17:25:11.128Z",
    "updatedBy": "Application Admin",
    "isDeleted": false
  }
}